{
  "doc_id": "seed-fin-001",
  "document_type": "financial",
  "scan_type": "native",
  "metadata": {
    "source": "seed"
  },
  "fields": [
    {
      "name": "revenue",
      "value": 250000000,
      "unit": "INR",
      "criticality": "critical",
      "page": 1
    },
    {
      "name": "net_profit",
      "value": 28000000,
      "unit": "INR",
      "criticality": "critical",
      "page": 1
    }
  ]
}
